{
  "event_id": "case-d-multi-source-stale",
  "market_id": "pm-case-d",
  "question": "Will SOL settle above $200 at resolution time?",
  "rule_text": "This market resolves YES if SOL/USD price is >= 200 at market close. Sources include price feeds, DEX TWAP, and news sentiment.",
  "resolution_source": [
    "source-chainlink-feed",
    "source-binance",
    "source-dex-twap",
    "source-news-aggregator"
  ],
  "market_end_time": "2026-03-01T00:00:00Z",
  "evaluation_time": "2026-03-01T00:30:00Z",
  "numeric_rule": {
    "operator": ">=",
    "threshold": 200
  }
}
