{
  "event_id": "case-c-eth-tight-margin",
  "market_id": "pm-case-c",
  "question": "Will ETH settle above $4,000 at resolution time?",
  "rule_text": "This market resolves YES if ETH/USD price is >= 4000 at market close using listed resolution sources.",
  "resolution_source": [
    "source-binance",
    "source-coinbase",
    "source-chainlink-feed",
    "source-kraken"
  ],
  "market_end_time": "2026-03-01T00:00:00Z",
  "evaluation_time": "2026-03-01T00:30:00Z",
  "numeric_rule": {
    "operator": ">=",
    "threshold": 4000
  }
}
